{
  "schema_version": "1.0",
  "lmt_version": "0.1.0",
  "source": {"file": "f2.wav", "duration": 6.0},
  "models": {"asr": {"name": "distil-large-v3", "repository": "Systran/faster-distil-whisper-large-v3", "revision": "0"}, "diarization": {"name": "speaker-diarization-3.1", "repository": "pyannote/speaker-diarization-3.1", "revision": "0"}},
  "speakers": [{"id": "S1", "label": "Speaker 1"}, {"id": "S2", "label": "Speaker 2"}],
  "segments": [
    {"start": 0.0, "end": 4.0, "speaker": "S1", "text": "The budget is fine."},
    {"start": 4.0, "end": 6.0, "speaker": "S2", "text": "Good."}
  ]
}
