{
  "schema_version": "1.1",
  "lmt_version": "0.1.0",
  "source": {
    "file": "meeting.wav",
    "duration": 4.0
  },
  "models": {
    "asr": {
      "name": "distil-large-v3",
      "repository": "Systran/faster-distil-whisper-large-v3",
      "revision": "0123abc"
    },
    "diarization": {
      "name": "speaker-diarization-3.1",
      "repository": "pyannote/speaker-diarization-3.1",
      "revision": "4567def"
    }
  },
  "speakers": [
    {
      "id": "S1",
      "label": "Speaker 1"
    },
    {
      "id": "S2",
      "label": "Speaker 2"
    }
  ],
  "segments": [
    {
      "start": 0.48,
      "end": 1.2,
      "speaker": "S1",
      "text": "Shall we?",
      "words": [
        {
          "start": 0.48,
          "end": 0.71,
          "text": "Shall",
          "probability": 0.97
        },
        {
          "start": 0.75,
          "end": 1.2,
          "text": "we?",
          "probability": 0.9
        }
      ]
    },
    {
      "start": 2.5,
      "end": 3.25,
      "speaker": "S2",
      "text": "Sí, José.",
      "words": [
        {
          "start": 2.5,
          "end": 2.8,
          "text": "Sí,",
          "probability": 0.812
        },
        {
          "start": 2.85,
          "end": 3.25,
          "text": "José.",
          "probability": 0.66
        }
      ]
    }
  ]
}
